{
  "$schema": "https://json-schema.org/draft/2020-12/schema",
  "title": "Persona Object Protocol v0.1",
  "description": "Minimal schema for a POP persona object.",
  "type": "object",
  "additionalProperties": false,
  "required": [
    "schema_version",
    "id",
    "name",
    "description",
    "traits",
    "anchors",
    "behavior",
    "memory_hooks",
    "plugins"
  ],
  "properties": {
    "schema_version": {
      "type": "string",
      "const": "pop-0.1"
    },
    "id": {
      "type": "string",
      "minLength": 1
    },
    "name": {
      "type": "string",
      "minLength": 1
    },
    "description": {
      "type": "string",
      "minLength": 1
    },
    "traits": {
      "type": "array",
      "items": {
        "type": "string",
        "minLength": 1
      }
    },
    "anchors": {
      "type": "array",
      "items": {
        "type": "object",
        "additionalProperties": false,
        "required": ["type", "value"],
        "properties": {
          "type": {
            "type": "string",
            "minLength": 1
          },
          "value": {
            "type": "string",
            "minLength": 1
          }
        }
      }
    },
    "behavior": {
      "type": "object",
      "additionalProperties": false,
      "required": ["tone", "interaction_style", "boundaries"],
      "properties": {
        "tone": {
          "type": "string",
          "minLength": 1
        },
        "interaction_style": {
          "type": "array",
          "items": {
            "type": "string",
            "minLength": 1
          }
        },
        "boundaries": {
          "type": "array",
          "items": {
            "type": "string",
            "minLength": 1
          }
        }
      }
    },
    "memory_hooks": {
      "type": "array",
      "items": {
        "type": "object",
        "additionalProperties": false,
        "required": ["id", "type", "description"],
        "properties": {
          "id": {
            "type": "string",
            "minLength": 1
          },
          "type": {
            "type": "string",
            "minLength": 1
          },
          "description": {
            "type": "string",
            "minLength": 1
          },
          "ref": {
            "type": "string",
            "minLength": 1
          }
        }
      }
    },
    "plugins": {
      "type": "array",
      "items": {
        "type": "object",
        "additionalProperties": false,
        "required": ["name", "entry_point"],
        "properties": {
          "name": {
            "type": "string",
            "minLength": 1
          },
          "entry_point": {
            "type": "string",
            "minLength": 1
          },
          "capabilities": {
            "type": "array",
            "items": {
              "type": "string",
              "minLength": 1
            }
          }
        }
      }
    }
  }
}
